<?xml version="1.0" encoding="UTF-8"?>

<mapaXML xmlns:xsi="http://www.w3.org/2001/XMLSchema-instance" xmlns="http://www.um.es/as"
	xsi:schemaLocation="http://www.um.es/as mapa.xsd">
	<id>124</id>
	<place>3</place>
	<width>500</width>
	<height>177</height>
	<NEAR>25</NEAR>
	<MOVE>40</MOVE>
	<MOVE2>20</MOVE2>
	<FACTOR>0.8</FACTOR>
	<MIN_BEA>3</MIN_BEA>
	<CONF_ALG>1</CONF_ALG>
	<beacon>
		<id>1</id>
		<x>4</x>
		<y>52</y>
		<coef>
			<c>0</c>
			<c>1</c>
		</coef>
	</beacon>
	<beacon>
		<id>2</id>
		<x>74</x>
		<y>52</y>
		<coef>
			<c>0</c>
			<c>1</c>
		</coef>
	</beacon>
	<beacon>
		<id>3</id>
		<x>138</x>
		<y>52</y>
		<coef>
			<c>0</c>
			<c>1</c>
		</coef>
	</beacon>
	<beacon>
		<id>4</id>
		<x>202</x>
		<y>52</y>
		<coef>
			<c>0</c>
			<c>1</c>
		</coef>
	</beacon>
	<beacon>
		<id>5</id>
		<x>266</x>
		<y>52</y>
		<coef>
			<c>0</c>
			<c>1</c>
		</coef>
	</beacon>
	<beacon>
		<id>6</id>
		<x>266</x>
		<y>76</y>
		<coef>
			<c>0</c>
			<c>1</c>
		</coef>
	</beacon>
	<beacon>
		<id>7</id>
		<x>222</x>
		<y>96</y>
		<coef>
			<c>0</c>
			<c>1</c>
		</coef>
	</beacon>
	<beacon>
		<id>8</id>
		<x>234</x>
		<y>148</y>
		<coef>
			<c>0</c>
			<c>1</c>
		</coef>
	</beacon>
	<beacon>
		<id>9</id>
		<x>302</x>
		<y>148</y>
		<coef>
			<c>0</c>
			<c>1</c>
		</coef>
	</beacon>
	<beacon>
		<id>10</id>
		<x>358</x>
		<y>148</y>
		<coef>
			<c>0</c>
			<c>1</c>
		</coef>
	</beacon>
	<beacon>
		<id>11</id>
		<x>384</x>
		<y>72</y>
		<coef>
			<c>0</c>
			<c>1</c>
		</coef>
	</beacon>
	<beacon>
		<id>12</id>
		<x>434</x>
		<y>52</y>
		<coef>
			<c>0</c>
			<c>1</c>
		</coef>
	</beacon>
	<beacon>
		<id>13</id>
		<x>500</x>
		<y>72</y>
		<coef>
			<c>0</c>
			<c>1</c>
		</coef>
	</beacon>
	<beacon>
		<id>14</id>
		<x>500</x>
		<y>152</y>
		<coef>
			<c>0</c>
			<c>1</c>
		</coef>
	</beacon>
	<beacon>
		<id>15</id>
		<x>438</x>
		<y>176</y>
		<coef>
			<c>0</c>
			<c>1</c>
		</coef>
	</beacon>
</mapaXML>